{
  "nics": [
    {
      "bus_id": "0000:27:00.0",
      "driver": "ena",
      "link_layer": "unknown",
      "max_pcie_gen": 0,
      "max_pcie_width": 255,
      "numa_node": 0,
      "port_speed_mbps": "unknown"
    },
    {
      "bus_id": "0000:28:00.0",
      "driver": "ena",
      "link_layer": "unknown",
      "max_pcie_gen": 0,
      "max_pcie_width": 255,
      "numa_node": 0,
      "port_speed_mbps": "unknown"
    }
  ],
  "rdma": [],
  "rdma_probe": "ok",
  "schema": 1
}
